response,context,context/0
And that's how you play the game!,Space. It seems to go on and on forever. But then you get to the end and the gorilla starts throwing barrels at you.,"By David X. Cohen amp; Matt Groening Transcribed by Dave, The Neutral Planet"
"Michelle, baby! Where you going?","Hey, Fry. Pizza goin' out! C'mon!!","You stink, loser!"
I hate my life I hate my life I hate my life.,"It's not working out, Fry. I put your stuff out on the sidewalk!","Michelle, baby! Where you going?"
"Hello? Pizza delivery for......Icy Wiener?! Aw, crud! I always thought at this point in my life I'd be the one making the crank calls! Here's to another lousy millennium.",Happy new year!,I hate my life I hate my life I hate my life.
What the?,One!,Wu!
"My God! It's the future. My parents, my co-workers, my girlfriend. I'll never see any of them again. Yahoo!",What the?,One!
Cool! Just like in Star Trek! Ow!,Have a nice future.,"Haven't you ever heard of a little thing called showmanship? Come, your destiny awaits!"
"Uh, Fry.","Good afternoon, sir. Name?",Cool! Just like in Star Trek! Ow!
Can I ask you a question?,I'm Leela. Now it's New Year's Eve so I'd like to decide your fate quickly and get out of here.,"Uh, Fry."
Uh...,As long as it's not about my eye.,Can I ask you a question?
Sort of.,Is it about my eye?,Uh...
What's with the eye?,Just ask the question.,Sort of.
"Cool, an alien! Has your race taken over the Earth?","I'm an alien, alright? Now let's drop the subject.",What's with the eye?
Wait a minute! Is that blimp accurate?,"No, I just work here.","Cool, an alien! Has your race taken over the Earth?"
"My God, a million years!",Yep. It's December 31st 2999.,Wait a minute! Is that blimp accurate?
"Y'know, I guess it should be but actually I'm glad. I had nothing to live for in my old life. I was broke, I had a humiliating job and I was beginning to suspect my girlfriend might be cheating on me.",I'm sure this must be very upsetting for you.,"My God, a million years!"
That's great! What's the little guy's name?,...great great great great great nephew.,Interesting. Your DNA test shows one living relative. He's your great great great great great great great...
Eurgh!,Professor Hubert Farnsworth.,That's great! What's the little guy's name?
"Y'know, I'm the luckiest guy in the whole future. I've been given a second chance and this time I'm not going to be a total loser. What's that?",Eurgh!,Professor Hubert Farnsworth.
Delivery boy? No! Not again! Please! Anything else!,Your permanent career assignment.,"Y'know, I'm the luckiest guy in the whole future. I've been given a second chance and this time I'm not going to be a total loser. What's that?"
What if I refuse?,Take your hands off me! You've been assigned the job you're best at just like everyone else.,Delivery boy? No! Not again! Please! Anything else!
Fine!,Then you'll be fired...,What if I refuse?
But I don't like being a delivery boy.,...out of a cannon into the Sun!,Fine!
Keep that thing away from me!,"Well that's tough! Lots of people don't like their jobs but we do them anyway. You gotta do what you gotta do! Now hold out your hand, I'm gonna implant your career chip. It'll permanently label you as a delivery boy.",But I don't like being a delivery boy.
See you in a thousand years! You owe me one.,"Hold still, damnit. I don't have good depth perception! You've got until the count of five to let me out of here. One...",Keep that thing away from me!
Whoa!,See you in a thousand years! You owe me one.,"Hold still, damnit. I don't have good depth perception! You've got until the count of five to let me out of here. One..."
Cool! Um. Cross Town Express?,JFK Jr. Airport.,Whoa!
"Hey! A phone booth! I can call my nephew. Wow, a real live robot! Or is that some kind of cheesy New Year's costume?",Pft! Tourist!,Cool! Um. Cross Town Express?
It doesn't look so shiny to me.,Bite my shiny metal ass.,"Hey! A phone booth! I can call my nephew. Wow, a real live robot! Or is that some kind of cheesy New Year's costume?"
"Yeah, I'd like to place a collect call.",Please select mode of death: Quick And Painless or Slow And Horrible.,"Listen, buddy, I'm in a hurry here. Let's try for a twofer!"
Help! What's happening?,"C'mon, c'mon! Kill me already! By the way, my name's Bender!","Great choice! Bring it on, baby!"
Why would a robot need to drink?,"Well that's your job, whether you like it or not and it's my job to make you do your job whether I like it or not - which I do - very much! Now get to work! Life is good!","Look, he's just a nobody who doesn't want to be a delivery boy. I'd really rather not force it on him."
Really? What do you do Bender?,"I don't need to drink, I can quit anytime I want! So they made you a delivery boy, huh? Man, that's as bad as my job.",Why would a robot need to drink?
You any good at it?,"I'm a bender. I bend girders, that's all I'm programmed to do.",Really? What do you do Bender?
What?,"You kidding? I was a star! I could bend a girder to any angle: 30 degrees, 32 degrees, you name it! But I couldn't go on living once I found out what the girders were for.",You any good at it?
Wait! You're the only friend I have!,"Suicide booths! Well, Fry, it was a pleasure meeting you, I'm gonna go kill myself.",What?
"Yeah, ever since I was six.",You really want a robot for a friend?,Wait! You're the only friend I have!
"Oh, no, it's the Cyclops! Don't look! Don't look!","Well, OK. But I don't want people thinking we're robo-sexuals, so if anyone asks, you're my debugger.","Yeah, ever since I was six."
Spock? Hey! Do the thing!,Welcome to the Head Museum. I'm Leonard Nimoy.,"We can hide in here, it's free on Tuesdays."
This is unbelievable! What do you heads do all day?,I don't do that anymore.,Spock? Hey! Do the thing!
"Yeah, well, if you're sorry why are you doing it?","I'm sorry, Fry, but I have to install your career chip.",Hmm.
Ow! Stoppit! Down boy! Bad president!,That's it! You just made my list!,Watch it!
"Wait a second. You're a bender, right? We can get out of here if you just bend the bars.","Oh, we're trapped!","Yeah, you know the law: You gotta do what you gotta do."
Who cares what you're programmed for. If someone programmed you to jump off a bridge would you do it?,"Dream on, skin tube. I'm only programmed to bend for constructive purposes. What do I look like, a de-bender?","Wait a second. You're a bender, right? We can get out of here if you just bend the bars."
"C'mon, Bender! It's up to you to make your own decisions in life. That's what separates people and robots from animals...and animal robots.",Open up!,I'll have to check my program...yep.
"Come on, Bender! You can do it.","You're full of crap, Fry! You make a persuasive argument, Fry.","C'mon, Bender! It's up to you to make your own decisions in life. That's what separates people and robots from animals...and animal robots."
Yes!,Can't...I...can't...do...it!,"Come on, Bender! You can do it."
I don't know how you did that.,"You were right, Fry! From now on I'm going to bend what I want, when I want, who I want! I'm unstoppable!",Yes!
Good Lord! What is this?,Looks like one of us will have to bend this grate.,"No, thanks."
"Its my old neighbourhood. Man, this brings back a lot of memories.","It's the decaying ruins of Old New York. Welcome home, pal!",Good Lord! What is this?
This is where I brought my girlfriend on our very first date.,"Keep 'em to yourself, pops.","Its my old neighbourhood. Man, this brings back a lot of memories."
My God! She's gone. Everyone I ever knew or cared about is gone.,This is where I brought my girlfriend on our very first date.,"Keep 'em to yourself, pops."
"Oh, can't you leave me alone? I'm miserable enough already.",Wait! There's someone you know!,My God! She's gone. Everyone I ever knew or cared about is gone.
"No, you don't. I've got no home, no family...","Look, I know it's not much consolation but I understand how you feel.","Oh, can't you leave me alone? I'm miserable enough already."
...My whole world is gone. You can't possibly understand what it feels like to be so alone.,No friends.,"No, you don't. I've got no home, no family..."
"Look, Leela, I don't understand this world but you obviously do, so I give up. If you really think I should be a delivery boy, I'll do it. Your chip. What are you doing?",I understand. I'm the only one-eyed alien on this whole planet. My parents abandoned me here as a baby and I don't even know what galaxy they were from. I know how it feels to be alone.,...My whole world is gone. You can't possibly understand what it feels like to be so alone.
Why?,Quitting.,"Look, Leela, I don't understand this world but you obviously do, so I give up. If you really think I should be a delivery boy, I'll do it. Your chip. What are you doing?"
What is the matter with you?,Because I've always wanted to. I just never realised it before I met you.,Why?
Correction. We're unemployed but we have a doddering old relative to mooch off of.,I don't wanna spoil the party but we're all job deserters now. We're unemployed and we have nowhere to go.,"Sorry. Well, that solves the mystery of the missing ring. This calls for a drink."
I'm your dear old Uncle Fry.,Who are you?,"Hello, I'm Dick Clark's head. Welcome to a special year 3000 edition of New Year's Rockin' Eve!"
Whoa! A real live spaceship!,Let me show you around. That's my lab table and this is my work-stool. And over there is my intergalactic spaceship! And here's where I keep assorted lengths of wire.,"Oh, my, no."
No!,"Attention, job deserters! Come out with your hands up. We have you partially surrounded.",I designed it myself. Let me show you some of the different lengths of wire I used.
I'll get us out of here.,I suppose it is technically possible. Though I am already in my pyjamas.,Can't we get away in the ship?
Blast-off!,One!,Two.
"So I guess without jobs, we'll be fugitives forever.",I can't see nothing. Pretty though!,Fire! Fire!
Yes! Yes! That's exactly the job I've always wanted!,Of those poor sons of -- but that's not important. The important thing is I need a new crew. Anyone interested?,New crew? W-What happened to the old crew?
This is awesome! Are we gonna fly through space fighting monsters and teaching alien women to lurve?,"Oh, that won't be a problem. As luck would have it I saved the chips from my previous crew.","Thanks for the offer, Professor, but we don't have the proper career chips."
Cool! What's my job gonna be?,If by that you mean transporting cargo then yes. It's a little home business I started to fund my research.,This is awesome! Are we gonna fly through space fighting monsters and teaching alien women to lurve?
"So, I'm gonna be a delivery boy?",You will be responsible for ensuring that the cargo reaches its destination.,Cool! What's my job gonna be?
Alright! I'm a delivery boy!,Exactly!,"So, I'm gonna be a delivery boy?"
Wow!,As new employees I'd like your opinion on our commercial. I paid to have it air during the Superbowl.,"By Ken Keeler Transcribed by Dave, The Neutral Planet"
Are there really giant birds like that?,Planet Express: Our crew is replaceable. Your package isn't.,"Thank you, sir!"
I'm never going to get used to the 31st century. Caffinated bacon? Baconated grapefruit? Admiral Crunch?,"No, no! That was all just special effects! Now let's have breakfast. I hope everyone likes eggs.",Are there really giant birds like that?
Hi -- eurgh!,"Now Fry, before you go into space you'll need to see our staff doctor. I should warn you though, he's a little unusual. He wears sandals!",Sign the paper!
I only have one.,Now open your mouth and let's have a look at that brain. No no no no no not that mouth!,You'll be fine.
"Uh, is there a human doctor around?",Really?,I only have one.
"Well, the doctor says I'm as healthy as a crab. Can I go into space now?",A little.,Ow!
Last time I checked.,"Hey! You're the unfrozen guy! From the 20th century, right?","As soon as we finish cleaning Bender. Oh, and Fry, this is our intern, Amy Wong. She's an engineering student of mine. I like having her around because she's the same blood type as me."
"Finally! Come on Bender, let's mosey!","Ah, to be young again. And also a robot! Now as I recall you youngsters have a package to deliver.","Hey, rich girl. Look over here! It's me, Bender. I'm being entertaining. La la la look at my head. It's all painted look at my head! I got a big old head, hey! Ho! Alright, show's over, I'm tired."
So where are we going anyway?,"Nice catch, idiot!","Finally! Come on Bender, let's mosey!"
The moon? The moon moon? Wow! I'm gonna be a famous hero just like Neil Armstrong and those other brave guys no one ever heard of!,Nowhere special. The moon.,So where are we going anyway?
Can I do the countdown?,Nothing will go wrong. If something goes wrong bring back the blood.,Well...I guess so. Just be careful. I'd like to hold off any major screwups until at least my second day as captain.
Ten......nine --,"Huh? Oh sure, knock yourself out.",Can I do the countdown?
"Hurry up, I wanna see the moon!",OK we're here!,Ten......nine --
That's one small step for Fry --,"Relax, its open till 9.","Hurry up, I wanna see the moon!"
"Wow! Um, can I have cuts?",And one giant line for admission!,That's one small step for Fry --
You're not gonna believe this but they landed an amusement park on the moon!,Hmm -- No!,"Wow! Um, can I have cuts?"
"Lets go, already!",Guh! It's the happiest place orbiting Earth.,You're not gonna believe this but they landed an amusement park on the moon!
Let's just dump it in the sewer and say we delivered it.,"Fry, we have a crate to deliver.","Lets go, already!"
I had more but you go ahead.,"OK, if everyone's finished being stupid",Too much work. Lets burn it and say we dumped it in the sewer.
But I've never been to the moon before.,We'll deliver that crate like professionals and then we'll go home.,I had more but you go ahead.
Clear!,Clear?,"Aye, aye, Captain! I mean only one eye. I mean, yes, sir, um, ma'am!"
Ready!,Ready to hoist?,Clear!
My first space delivery.,Ow!,Ready!
"Uh, greetings, Moon Man, we come in peace. I am Fry from the planet Earth.",My first space delivery.,Ow!
"But you are lazy, right?","Wise guy, huh? If I wasn't so lazy I'd punch you in the stomach.","Uh, greetings, Moon Man, we come in peace. I am Fry from the planet Earth."
"Hey, I got you guys refrigerator magnets.",Idiots who need gifts for other idiots.,Who buys this trash?
So you flip out and start acting like some crazy folk singer?,"Get it off! Get it off! Get it -- uh oh! How many roads must a man walk down, before you... Keep those things off of me! Magnets screw up my inhibition unit!","Hey, I got you guys refrigerator magnets."
This is weak!,Because it's a little meteor!,Why does a moon rock taste better than an Earth rock?
"I don't know. This place is great and all but its just so artificial. The gravity, the air, the gophers. You might as well stay on Earth. That's what I came to see! I wanna go out there and jump around like an astronaut. Screw this phoney stuff!","What's wrong, Fry?",Address all complaints to the Monsanto Corporation.
I don't care how educational it is. Let's do it!,Maybe I should take Fry on the Luna Rover ride. You get to wear a space suit and drive around on the surface. And the line's short because it's educational.,Yeah! You're the kind of guy who visits Jerusalem and doesn't want to see the Sexeteria!
Finally! Get ready for some serious moon action.,Next year in Jerusalem!,I don't care how educational it is. Let's do it!
"That's not an astronaut, it's a TV comedian. And he was just using space travel as a metaphor for beating his wife.","Wow, I never realised the first astronauts were so fat!","One of these days, Alice. Bang! Zoom! Straight to the moon!"
I do.,"No one knows where, when or how Man first landed on the moon...",What do I look like? A guy who's not lazy?
That's not how it happened.,...and sing a whaling tune. We're whalers on the moon...,"We carry a harpoon,"
This is stupid. I'm taking this thing out to the real moon.,"Oh, really? I don't see you with a fungineering degree! pgt;",That's not how it happened.
Not for long!,"Fry, no. This is my first mission and I'm not gonna let us get in any trouble. Besides, the car's on a track.",This is stupid. I'm taking this thing out to the real moon.
Agreed. Yee-haw! Woo! Yeah! Crank up the radio!,"OK, you're on the surface. Now I'll give you 10 minutes. Then you'll get bored, turn around and apologise for being such a jerk. Agreed?",Ooh aah! I died doin' what I loved.
Yee-haw!,We're whalers on the -,Agreed. Yee-haw! Woo! Yeah! Crank up the radio!
No not yet. How 'bout we go look for the original moon landing site?,Time's up. Make a U-turn at the next crater.,Yee-haw!
Well I'm feelin' lucky! Uh... I'm ready to go back now.,That's crazy! It's been lost for centuries!,No not yet. How 'bout we go look for the original moon landing site?
"We're gonna die! It's every man for himself! Help me, Leela! You did it! We're safe!",Well I'm feelin' lucky! Uh... I'm ready to go back now.,That's crazy! It's been lost for centuries!
It's every man for himself.,No. Now we're gonna die.,"We're gonna die! It's every man for himself! Help me, Leela! You did it! We're safe!"
"I'm sorry, Leela, I can't go on any further. Just leave me to die in that barn over there.","Yeah, well, I'm gonna go build my own theme park, with blackjack and hookers. In fact, forget the park!","Here, let me do it. Ah, lousy arm. Must be rigged! That's her, officers! Uh, that's the woman who programmed me for evil!"
"No, sir. We're amusement park patrons.","Trespassers, eh?",Thank God!
I guess we could do chores for a few hours.,"Huh, borry? Looky here, city girl, oxygen don't grow on trees. You'll have to earn it doing chores on my hydroponic farm. You can go back to your precious theme park at sun up.",Our car broke down and we're out of oxygen. Can we borrow some?
Fahrenheit or Celsius?,Yup. Drops down to -173!,"Fry, night lasts two weeks on the moon."
Robot daughters?,"First one, then th'other. And them spacesuits ain't a-heated so you aint goin' nowhere til sunrise. You can sleep in the barn. Just don't be a-touchin' my three beautiful robot daughters. Y'hear?",Fahrenheit or Celsius?
Whoa!,Yoo-hoo.,And the Crushinator.
"And it was great! We got to see craters and rocks and that one incredible rock that looked like a crater and, and these fellas.","I told you to turn around and go back to the park. But oh, no, the park was too phoney. We had to see the real moon.",Whoa!
I guess I can't.,"Fry, face it. The moon is a dump. It's a boring dried up wasteland. And the only reason anybody ever comes here is for the tacky little amusement park. Can't you just accept that?","And it was great! We got to see craters and rocks and that one incredible rock that looked like a crater and, and these fellas."
"Oh, Bender. You didn't touch the Crushinator, did you?",Bender?,He'll never find me in here.
It's too low.,"Yes, Pa.","Oh, no you don't! C'mere Crushinator."
"Hey, cool! Dark side of the moon!","No, Pa. I love him.","God darn, it Crushinator, jump!"
Over there! Look! It's the moon landing site! We found it!,We can't outrun it forever.,"Oh, dear! I really ought to do something. But I am already in my pyjamas."
"It's that flag from MTV! And Neil Armstrong's footprint! Hey! My foot's bigger! Leela, isn't this the greatest thing you've ever seen?","Quick, get in.",Over there! Look! It's the moon landing site! We found it!
"Look, Leela, I'm sorry. I never should have dragged you out here.",Well if the oxygen holds out we might live long enough to starve to death.,"Oh, no room for Bender, huh? Fine! I'll go build my own lunar lander, with blackjack and hookers. In fact, forget the lunar lander and the blackjack. Ah, screw the whole thing."
I never told anybody this but a thousand years ago I used to look up at the moon and dream about being an astronaut. I just didn't have the grades. Nor the physical endurance. Plus I threw up a lot and nobody liked spending a week with me.,"That's right, you shouldn't have. I still don't get what the big attraction is.","Look, Leela, I'm sorry. I never should have dragged you out here."
"The moon was like this awesome, romantic, mysterious thing, hanging up there in the sky where you could never reach it, no matter how much you wanted to. But you're right. Once you're actually here it's just a big dull rock. I guess I just wanted you to see it through my eyes, the way I used to.",A week would be a little much.,I never told anybody this but a thousand years ago I used to look up at the moon and dream about being an astronaut. I just didn't have the grades. Nor the physical endurance. Plus I threw up a lot and nobody liked spending a week with me.
It's Amy! We're saved!,"Had to come back for the Crushinator, eh, robot? Well I got you this time.","Fry, look. It really is beautiful. I don't know why I never noticed before."
"Well, close enough!","So, Fry, was the real moon anything like the moon you used to dream about?","She'll be riding six white horses when she comes,"
I'm sorry. I was up really late poking through people's desks.,"Fry, mon, if you're going to be living in the office you could at least be on time for work.",Hey!
And great lift!,What the hell are you doing?! You're getting a huge dose of radiation!,"Concerning our pest problem: Somebody's been leaving food around and it's attracting owls. And I, for one, am getting tired of cleaning those owl traps. Now......as this shocking graph indicates, our water consumption has tripled in the last month. I notice Fry has been here for a month, so I'm appointing him head of a committee to find who's responsible. Fry? Am I cracking up, or is Fry's living here starting to get in the way of bus -"
"Hey, when you look this good, you don't have to know anything.",Do you know how long it's going to take me to recalibrate these engines?,And great lift!
"Hey, Professor, great jerky!","Oh, fuff! He's not causing any trouble. Now, if you don't mind, I'm rather busy. I seem to have mislaid my alien mummy. This sarcophagus should contain the remains of Emperor Nimballa, who ruled Zubin 5 over 29 million years ago.",He's a nice guy but we think it's about time he got his own place.
"Sheesh! 40,000 channels and only 150 have anything good on.",And Bigfoot is down!,Bachelor chow: Now with flavour!
"Hmm, must be a friend of theirs.","Metric? I've always known. But for you, my darling, I'm willing to convert.","Oh, Calculon! It fits! Then you must know that I'm --"
I know but I forgive you.,"Fry, sometimes in close quarters, people do inconsiderate things without realising it.","Hey, All My Circuits! Move over. Ahh!"
Uh-huh.,"No, Fry, by close quarters I mean this office...",I know but I forgive you.
Right.,...and by people I mean you!,Uh-huh.
Leela! We're trying to watch TV.,And by inconsiderate I mean --,Right.
"So, who's that weird-looking guy?","Yeah, would you kindly shut your noise hole?",Leela! We're trying to watch TV.
What's he do?,That's a human.,"So, who's that weird-looking guy?"
Boring!,"Eh, the usual human stuff. He laughs, he learns, he loves.",What's he do?
"Hey, uh, why is the TV getting smaller?","That's what I wanted you to think with your soft, human brain.",Calculon? I thought you were in a coma.
It looked good but I just don't feel like eating. You want it?,"Cheer up, meatbag, you've barely touched your amoeba.",We'll bill you for the couch.
What are the cigars for?,"Nah, I'm trying to watch my input. I need plenty of wholesome, nutritious alcohol. The chemical energy keeps my fuel cells charged.",It looked good but I just don't feel like eating. You want it?
I can't believe they threw me out like that. I must have been really acting like a jerk.,They make me look cool.,What are the cigars for?
I don't know. Do refrigerators still come in cardboard boxes?,"Yeah, but everybody's a jerk. You, me, this jerk. That's my philosophy. So, where you gonna stay?",I can't believe they threw me out like that. I must have been really acting like a jerk.
Really? That'd be great! You sure I won't be imposing?,"Yeah, but the rents are outrageous. Why don't you just come move in with me?",I don't know. Do refrigerators still come in cardboard boxes?
"Cool! Y'know, I've never even seen a robot's apartment before.",Here we are. Your new home.,"Nah, I've always wanted a pet."
It's kinda cramped in here. I don't even have room to hang my clothes.,"Let's see, where to start. OK, this is the TV area, that over there's the breakfast nook, and over here is where you'll be living which is great because, until now, it's just been wasted space.","Come on in, I'll give you the tour!"
"Wait, Bender. Bender?","Look, pal, you've only got one set of clothes and you're not taking them off while I'm here. Well, I'm bushed. G'night.",It's kinda cramped in here. I don't even have room to hang my clothes.
"Bender, wake up!",Kill all humans...kill all humans...must kill all the humans.,"Wait, Bender. Bender?"
"Uh, listen, Bender, uh, where's your bathroom?",I was having the most wonderful dream. I think you were in it.,"Bender, wake up!"
Bathroom.,Bath what?,"Uh, listen, Bender, uh, where's your bathroom?"
Bathroom!,What room?,Bathroom.
"Ah, never mind!",What what?,Bathroom!
"Oh, it's Bender's apartment. He put in carpeting yesterday so now my head hits the ceiling. Hey, do you realise you're standing at a weird angle? Now you're OK.",What happened to you?,"Yeah, this past week with Fry's been a blast! Y'know, beneath this warm, sunny exterior, beats the cold, mechanical heart of a robot."
Is that an invitation?,Look at yourself. You're a wreck! You've got to find a new place to live.,"Oh, it's Bender's apartment. He put in carpeting yesterday so now my head hits the ceiling. Hey, do you realise you're standing at a weird angle? Now you're OK."
