response,context,context/0
"Ooh, yeah. Anyone have a camera?",It's very nice. We should get a picture before the tide comes in.,Voila. The greatest sandcastle ever built. This is the kind of castle King Arthur would have lived in -- If he were a fiddler crab.
Nooo!,What in Babylon?,"Oh, my God!"
"We're all gonna die, aren't we?",Faster!,Nooo!
A what?,"Whoa, whoa, whoa, whoa, hold on. I refuse to fight. I'm a conscientious objector.","Well, you heard the windbag: We've been drafted. Everyone into the ship."
You mean while I'm sleeping in it?,"The key to victory is discipline, and that means a well-made bed. You will practise until you can make your bed in your sleep.","Right, right. Nobody destroy Leela either."
W-Wouldn't it make more sense to send the robots in first a--,"The alien mothership is in orbit here. If we can hit that bullseye the rest of the dominoes will fall like a house of cards. Checkmate. Now, like all great plans, my strategy is so simple an idiot could have devised it. On my command all ships will line up and file directly into the alien death cannons, clogging them with wreckage.","You won't have time for sleeping, soldier. Not with all the bed-making you'll be doing."
"I'm gonna be a science-fiction hero, just like Uhura, or Captain Janeway, or Xena!",Here's hoping.,"Maybe we should wait 'til afterwards, in case neither of us comes back."
"Sure, I just like TV better.","Fry, this isn't TV, it's real life. Can't you tell the difference?","I'm gonna be a science-fiction hero, just like Uhura, or Captain Janeway, or Xena!"
"Alright, scumwads. This one's for Bender's cocktail!","The auxiliary power's out, and they spilled my cocktail.","Bender, damage report."
Miniskirts? That sounds familiar.,Really?,She wears miniskirts and is promiscuous.
"Wait, I know her.",We will accept no more decoys. This is the McNeal.,Maybe that's just her excuse for being incompetent.
"That's where I know her from. She's Jenny McNeal. She was a character on a TV show back in the 20th century, Single Female Lawyer.","You do not, you big fat liar. You don't know anyone. All you do is watch TV.","Wait, I know her."
It's crazy! How could they even know about a show from a thousand years ago?,They're going to destroy the entire Earth if they don't see some stupid TV show about some bimbo lawyer?,I'm beginning to think there'll be no forced mating at all.
Magic. Got it.,"Well, Omicron Persei 8 is about a thousand light years away. So the electro-magnetic waves would just recently have gotten there. You see--",It's crazy! How could they even know about a show from a thousand years ago?
Beer -- I would think.,Check this out: Back in 1999 the season finale of Single Female Lawyer was interrupted by technical problems. Apparently some zidiot spilled Coke on the transmitter.,Magic. Got it.
"Y'know, I saw the first 30 seconds of that episode. If I could make up an ending, maybe we could act it out ourselves.","No, there wouldn't be. Most videotapes from that era were damaged in 2443 during the Second Coming of Jesus.",There aren't any copies left.
Let's put on a show.,"And I, I could be an acting coach!",I have an old five-megawatt broadcasting tower in the attic.
"OK, Leela, you'll be starring as Jenny--",Let's put on a show.,"And I, I could be an acting coach!"
"Places, everyone.",Gimme the script.,"Plus, you don't really have the thighs for a miniskirt."
Lights! Camera one! Camera two! Camera three!,OK ... all set!,"Places, everyone."
"Well, it took an hour to write. I thought it would take an hour to read.","Uh, g-- uh, getting back to the, uh, matter, uh-uh, if it please the court ... Fry, there's nothing else here. You only wrote two pages of dialogue.",Aha!
"I don't know, I don't know. Just say anything. As long as it's compelling, mesmerising, a tour de force.",What are we supposed to do now?,"Well, it took an hour to write. I thought it would take an hour to read."
"No, no! Go to commercial!","I say ... I'm giving up the law. And I'm giving up being single. Your Honour, will you marry me?","What say you, Single Female Lawyer?"
Married? Jenny can't get married.,We'll be back after this word from Crazy Bender's Discount Stereo.,"No, no! Go to commercial!"
"But that's not why people watch TV. Clever things make people feel stupid, and unexpected things make them feel scared.","Why not? It's clever, it's unexpected.",Married? Jenny can't get married.
You see? TV audiences don't want anything original. They wanna see the same thing they've seen a thousand times before.,"Attention, McNeal. Your unexpected marriage plan scares us. You stole our hearts as a single female lawyer, and so shall you remain -- or else!","But that's not why people watch TV. Clever things make people feel stupid, and unexpected things make them feel scared."
"Trust me on this. While other people were out living their lives, I wasted mine watching TV, because deep down I knew it might one day help me save the world. Plus, I would have lost my Workman's Comp if I hadd gone outside. Now just read these cue cards.","Whatchoo talkin' 'bout, Fry?",You see? TV audiences don't want anything original. They wanna see the same thing they've seen a thousand times before.
And action!,"Trust me on this. While other people were out living their lives, I wasted mine watching TV, because deep down I knew it might one day help me save the world. Plus, I would have lost my Workman's Comp if I hadd gone outside. Now just read these cue cards.","Whatchoo talkin' 'bout, Fry?"
And ... cut!,Hooray!,Hooray!
"Way to overact ,Zoidberg!","Attention, McNeal. We are reasonably satisfied with the events we have seen. Overall I would rate it a C, OK, not great. As a result, we will not destroy your planet. But neither will we provide you with our recipe for immortality.","Single Female Lawyer, Having lot's of sex-- Huh?"
"Yep. It was just a matter of knowing the secret of all TV shows; At the end of the episode, everything's always right back to normal.","You did it, Fry!","And now we must return to our planet, to catch the end of a thousand-year-old Leno monologue."
"By Lewis Morton Transcribed by Dave, The Neutral Planet",FUTURAMA,"Yep. It was just a matter of knowing the secret of all TV shows; At the end of the episode, everything's always right back to normal."
I like those odds. Rats. Just another tooth. Aah!,No purchase necessary unless you wish to enter the contest. Odds of winning mathematically insignificant.,I won!
I gotta find that golden bottle-cap.,I like those odds. Rats. Just another tooth. Aah!,No purchase necessary unless you wish to enter the contest. Odds of winning mathematically insignificant.
This is nothing. Back in high school I used to drink a hundred cans of cola a week. Right up until my third heart attack.,I've never seen anyone so addicted to Slurm.,I gotta find that golden bottle-cap.
"I'm not Bender, I'm Fry.","I'll have a look, but I remind you, I'm an expert on humans not robots.","Bender, mon, lie yourself down. You're payin' for that!"
Nope. Human.,Really? I though you were the robot.,"I'm not Bender, I'm Fry."
I 'unno. Try it on me. Ow! My sperm!,What should we point it at first?,"Well, I've got to go take this suit to the decontaminators. You two lock up the F-ray and for the love of God don't let it fall into the wrong hands."
"Huh, didn't hurt that time.","Wow, neat! Mind if I try that again?",I 'unno. Try it on me. Ow! My sperm!
What's wrong?,"Whoa, mama! Hold still, sexy lady.","Huh, didn't hurt that time."
"All this prolonged exposure to radiation is making me thirsty. Ah, if only there was some way of knowing which can had the winning bottle-cap inside.","You couldn't afford it, honey.","Hey, bite my shiny metal ass!"
"Wait a second. I'm getting an idea. N-No, false alarm. No. Yeah. No. Yeah. No. Wait. No. Yeah. Yeah. No ... no. Yes!","Huh, w-what? I didn't hear you. I was too busy using this F-ray to look inside of things.","All this prolonged exposure to radiation is making me thirsty. Ah, if only there was some way of knowing which can had the winning bottle-cap inside."
"We checked 90,000 cans of Slurm and all we won was this junk. I never wanna see another can of Slurm again. Man, am I thirsty.","Ah, this thing stinks.","Wait a second. I'm getting an idea. N-No, false alarm. No. Yeah. No. Yeah. No. Wait. No. Yeah. Yeah. No ... no. Yes!"
Hooray!,"You did it, Fry! You found the winning bottle-cap! We won!","Fry, are you alright?"
Uh-huh. Can we have our free Slurm now?,"Welcome to the planet Wormulon. I'm Glurmo, your golly-rific guide to the splend-tacular Slurm factory.",Hey!
"So, what's the secret ingredient?","As we sail down the river of Slurm you'll see our mix-ologists at work. They take 900 of the finest ingredients, add a touch of child-like delight and mix it all with glacial spring water from our glacial spring water generator. Then, last of all, we add the secret ingredient that makes Slurm so deliciously addictive.",Tell them I hate them.
Oh. But what is it really?,It's whatever your imagination wants it to be.,"So, what's the secret ingredient?"
Why?,Enough! There will be no further questions.,I'm just asking cause they look kind of secret.
So thirsty.,"Now on your right, you'll see the Slurm Master checking the Slurm for colour and bouquet.",I heard that!
"Uh, could I have some Slurm, please?","Then he tastes it. He tastes it and tastes it, then tastes it some more.",So thirsty.
When will that be?,No food or drink allowed on the tour. You'll have to wait until you're partying with Slurms MacKenzie.,"Uh, could I have some Slurm, please?"
That's not soon enough.,Soon enough.,When will that be?
I'm dying of thirst. Grab my feet and dunk my head in so I can drink.,What are you doing?,That's right. They think they have a good union but they don't. They're basically slaves.
Fine. I'll let go and swim around in the Slurm and drink as much as I want. Help! I can't swim!,No. That's moronic.,I'm dying of thirst. Grab my feet and dunk my head in so I can drink.
This isn't Slurm at all!,And why is the Slurm pouring into this sewer?,Where are we?
My God. What if the secret ingredient ... is people?,This all must have something to do with the secret ingredient.,Something's rotten on the planet Wormulon. Look at this.
Oh. How is it?,No. There's already a soda like that: Soylent Cola.,My God. What if the secret ingredient ... is people?
"Look! Slurm! Finally! Oh, yeah! I'm never going 12 minutes without a Slurm again.",Quick.,If you'll excuse me.
"Well, whatever it is, it's even better fresh. Mmm, still warm.",It's the end of the line. This must be where they put in the secret ingredient.,"Look! Slurm! Finally! Oh, yeah! I'm never going 12 minutes without a Slurm again."
Ew!,"Well, whatever it is, it's even better fresh. Mmm, still warm.",It's the end of the line. This must be where they put in the secret ingredient.
That's the secret ingredient of Slurm?,Fry! Fry!,"Oh, Lordy!"
Ew!,That's the only ingredient of Slurm.,That's the secret ingredient of Slurm?
"Thanks, Bender!","I'll save us! Oh, that feels good!",Ew!
Who's behind does that come from?,Is it? Honey comes from a bee's behind. Milk comes from a cow's behind. And have you ever used toothpaste?,How can you trick people into drinking something that comes out of your behind? It's disgusting.
What about me?,"Yes! Which is why we'll market it as New Slurm. Then, when everyone hates it, we'll bring back Slurm Classic, and make billions!","But, your highness, she's a commoner. Her Slurm will taste foul."
Yes!,You are free to go ...,What about me?
Mmm!,"... if you can resist this concentrated super Slurm! It's so delicious, you'll eat until you explode! Oh, which reminds me, put a tarp over that sofa, will you? Bon apptit!",Yes!
Here I come. Let me just-- One more taste.,"Fry, untie us, quick!","Farewell! Oh, and congratulations again on winning the contest."
I can't stop eating this delicious ooze. But I'm not gonna let you die.,"Yeah, we're boned.",I can't see what's happening. Are we boned?
I could fit if I didn't have these damn arms!,What's happening? Just in time!,Hurry!
Say what?,Shh! I want you to take me with you.,Slurms MacKenzie?
But she'll crush you like a worm ... crushing a smaller worm.,"Go on without me, I'll hold her off.",She's gaining on us.
"Outlaw Slurm? Uh, don't pay any attention to him sir ...","Hmm, hiney, you say? Why, with your testimony we'll finally be able to outlaw this insidious Slurm.","Commissioner, my crew has made a horrific discovery: It seems that Slurm is produced in a colossal worm hiney!"
... Grandpa's making up crazy stories again.,"Outlaw Slurm? Uh, don't pay any attention to him sir ...","Hmm, hiney, you say? Why, with your testimony we'll finally be able to outlaw this insidious Slurm."
"Ah, I just wish Slurms MacKenzie were here to enjoy this with me.","OK, grandpa, we'll take care of the bad worms, don't you worry.","I'm not your grandpa, you're my uncle! From the year 2000!"
For Slurms!,For Slurms!,For Slurms!
Mmm!,"Hey, that's not that bad.",Whammy-wazzle!
Is it me?,Aww! Somebody likes snouts.,Futurama is brought to you by ... ... Glagnar's Human Rinds. It's a buncha muncha cruncha human!
"You alright, Bender?","Ow, my head! My precious head! Stupid can opener. You killed my father and now you've come back for me!",Is it me?
"Hey, what are these rings in Nibbler's fang?","OK, well I believe I have a replacement fang for your pet in the next room. The jaguar didn't wanna cooperate but luckily he knocked one of my teeth out. Now then.",Next time I'm keeping it.
"Yeah, well, good luck. It'd take some kind of genius to count all those rings.","Um, I'm still a little woozy from a gazelle kick this morning but if he's anything like the common tree, the rings might indicate his age.","Hey, what are these rings in Nibbler's fang?"
Who's playing pin the tail on the moon maggot?,I'd be cuddly too if someone gave me a new cape.,"Aww, look how cuddly he looks in his new cape!"
... and you smell like one too!,"What day is today? It's Nibbler's birthday, What a day for a birthday, Let's all have some cake.","Come on, let's all sing Happy Birthday!"
Uh-oh. Is this gonna be another crazy experiment that crosses a line Man was not meant to cross?,"Actually, through the miracle of science, that can be arranged.",I wish just once Bender could feel exactly what I feel.
And that'll allow Bender to feel other people's emotions?,"Quiet, you. I'm installing an empathy chip.",Why don't you just use a potted plant like Fry?
Thanks for covering.,Uh ... that's me.,"Now I'm worried that I'm not as smart as Leela, but at the same time I feel relieved that I'm cuter than her."
What's your problem?,A puppy? Nibbler loved to eat puppies.,"Hey, you know what'd cheer you up? You should get a puppy."
You do?,I miss Nibbler.,What's your problem?
What?,"Uh-oh, jealousy. You think you're so hot!","Hell, no! It's Leela's stupid feelings. Why can't she just drink herself happy like a normal person?"
They're just responding to my personality.,The only reason you get all the guys is because you dress like a tramp!,What?
The spoon's in the foot powder.,I'm so lonely. I'm gonna go eat a bucket of ice cream. A bucket of ...,Sure. I'm having a great time -- really. You two go enjoy yourselves.
"Too bad he wasn't an alligator. Y'know, when you flush those things they stay alive in the sewers.","I'm at the end of my rope. I can't live another minute without poor, sweet Nibbler.",The spoon's in the foot powder.
Yep. My friend's cousin's caseworker saw one once. It's a widely-believed fact.,Really?,"Too bad he wasn't an alligator. Y'know, when you flush those things they stay alive in the sewers."
Bender? Bender?!,"Hang on, Nibbler. Uncle Bender's coming to save you. Damn, it's too small. What did those human design this for anyway? Aha! Bender, one; toilet, zero! See you on the other side!","Hmm, sewers. Thinking, thinking, thinking."
Have you seen my sombrero?,Bender? Bender?!,"Hang on, Nibbler. Uncle Bender's coming to save you. Damn, it's too small. What did those human design this for anyway? Aha! Bender, one; toilet, zero! See you on the other side!"
"Hey, it's your fault. He only flushed himself because your emotions made him feel bad.",Now he's flushed himself down the toilet? Who's he gonna flush next?,Have you seen my sombrero?
"Oh, great, now you're making him feel worse!",You're right. I feel terrible.,"Hey, it's your fault. He only flushed himself because your emotions made him feel bad."
God bless America.,"Oh, don't be so sure. Many scientists believe humans really could mutate down there. Uh, due to exposure to toxic waste and radioactive runoff and good old American faeces.",There's no such thing as mutants. That's a ridiculous urban myth.
"Phew! Uh, ladies first.",God bless America.,"Oh, don't be so sure. Many scientists believe humans really could mutate down there. Uh, due to exposure to toxic waste and radioactive runoff and good old American faeces."
"Oh, and the aftertaste!","Phew! Uh, ladies first.",God bless America.
I burned my finger.,What is it?,"Oh, and the aftertaste!"
"Looks like we're under Park Avenue. Ooh, ritzy! Just think: All this was probably once a charity luncheon for the Met.","OK, check the guidebook.",I burned my finger.
Eck! This emotional display is making me nauseous. Or maybe it's whatever that is.,He was so sweet.,He was so cute.
"Hmm. According to this map, the only way out is through ... that pipe. Don't worry. It gets wider after about a mile.","It's no use. We'd better turn back. Which way, Fry?",Nibbler?
"OK, OK, nevermind. I'll just ask those people for directions.",Idiot.,Idiot.
I'll take care of this! Back! Back!,Mutants! They're real!,Mutants!
"Hey, aren't you supposed to be eating our brains? You're mutants.",Lay off him. You know he's only got one ear.,I said harmless not armless.
Daylight and everything.,"No, we're on the top.",Perhaps. But perhaps your civilisation is merely the sewer of an even greater society above you.
Wow. You guys worship an unexploded nuclear bomb?,And over here is our church.,Nothing but crumpled porno and Ayn Rand.
"So, is it true that alligators flushed down the toilet survive down here?","Come to Daddy, sweetie-ookums.",Nibbler?
I'll take care of this.,That's El Chupanibre.,Say what?
"Leela, your scaredness is being transmitted straight to Bender. If you care about Nibbler, stop caring about him!",I'm too scared.,"Bender, do something."
Even me?,I can't. I love every living creature.,"Leela, your scaredness is being transmitted straight to Bender. If you care about Nibbler, stop caring about him!"
Damn.,As a friend.,Even me?
Bender's gonna be killed!,"Bender is back. I'll save you, Nibbler.",Yeah. And I could afford it all if I didn't have to feed that stupid Nibbler.
Yeah!,You know what else I could use? A weekend at one of those fancy spas. And a Toblerone.,Bender's gonna be killed!
Looks like Bender learned an important lesson about respecting other people's feelings afterall.,"Bender, you won't believe this, but the empathy chip burned out. The emotion you felt for Nibbler was actually your own.",I love you too. Get that stupid chip out of me before I kill myself!
Hmm. Horsey to pointy guy six. Check.,"By Lewis Morton Transcribed by Dave, The Neutral Planet",FUTURAMA
Good move.,"Hmm. Get him, boys!",Hmm. Horsey to pointy guy six. Check.
Sorry.,Nope. Watching cartoons.,"Good news, everyone. We have a mission to further the noble cause of intergalactic peace."
DOOP? What's that?,It's a delivery for the Democratic Order Of Planets.,What's the mission?
Uh...,"It's similar to the United Nations from your time, Fry.",DOOP? What's that?
Oh!,Or like the Federation from your Star Trek programme.,Uh...
"Wow! There's a million aliens. I've never seen anything so mind blowing. Ooh, a reception table with muffins!","Alright, but don't run with them.",We'll get them there as quickly as we can.
"So, what's it like on planet Amazonia?","Ladies and gentlemen, welcome to the ribbon-cutting ceremony of the DOOP's magnificent new headquarters. A fitting home for an organisation that has fostered peace throughout the universe. Even between the Insectoids and the Space Lizards.","Wow! There's a million aliens. I've never seen anything so mind blowing. Ooh, a reception table with muffins!"
That's so interesting. Maybe we could get to know each other over a coffee.,Big rats there. Me crush with club.,"So, what's it like on planet Amazonia?"
"Hey, Bender?","Come, Kif, it's time to begin our life as civilians. That's an order, soldier.","No, it doesn't."
"You don't have to get so mad, Leela.","Alright, this is the third hose fight I've broken up today and the second one using actual hoses. Now move your lazy asses and start scrubbing the ship like I ordered you to.",Yeah?
She's really strict.,"So, this Leela. I know she's a very sensuous woman but what manner of captain is she?","Oh, yes, yes. My good friend, of course. Anyway, whoever you all are, I have good news. You'll be making a delivery to Stumbos 4, a planet with such high gravity you'll most likely be crushed under the weight of your own hair. Enjoy."
"No, she just makes us do work and stuff.",I see. Does she by any chance give the crewmembers spankings?,And mean.
"Hey, no prob', this lead apron'll protect me.",They're not heavy in here because we have an anti-grav pump. But once you get out on the surface the gravity will be very intense.,They're not very heavy but you don't hear me not complaining.
Yeah!,"Hey, here's an idea, let's deliver all the pillows at once.",I don't want any screw-ups. Use the hover-dolly and just deliver one pillow at a time.
"Alright, don't get your panties in a knot. We'll just use the back-up dolly.",I told you dumb apes not to overload it. Each of those pillows weighs 150lbs here.,"Some breaking occured, the dolly was involved, that's about all we know."
I agree.,"I'm Leela, get to work, neh neh neh.",Just get to work.
"Ah, some good old high-gravity rain. That'll cool us off.","Oh, alright. Um ... well ... how 'bout then, um...OK, well, there he was in the tub, alright?","Y'know, why don't we talk about something besides Zapp for a while?"
"Yeah. If she had let us use the back-up dolly, we could have broken it, given up and gone home by now.",This is all Leela's fault.,"Ah, some good old high-gravity rain. That'll cool us off."
"Ah, Leela's not that bad. I just wish she didn't make us work so much.","Y'know boys, a good captain needs many skills, such as boldness, daring and a velour uniform. And I'm not convinced Leela has any of those things.","Yeah. If she had let us use the back-up dolly, we could have broken it, given up and gone home by now."
Underpants?,Beer?,"Back when I was captain all I asked from my men was their complete loyalty. If I had that, then for all I cared they could sit around the whole day drinking beer in their underpants."
This is a mutiny.,"But now, Zapp's not captain anymore. I'm free! Oh, you hear that? I'm actually laughing!",Underpants?
All hail the new captain.,"You're outta here, lady. Zapp's the new captain.",This is a mutiny.
We don't have a brig.,Failure to prevent a mutiny. Throw her in the brig.,"On what grounds, you slobbering oaf?"
You were mean and you yelled and you made us do all that work.,"But, didn't I do a good job?","You got it, genius."
"Yeah, well, you shouldn't have been such a mean captain then.","Sometimes a captain needs to do those things. Besides I, I thought we were friends.",You were mean and you yelled and you made us do all that work.
Ten hundred percent!,To the ends of the universe.,"Take them to the laundry-brig. So, do I have your loyalty, men?"
"Ooh, burn!","Maybe not to you, Kif, but if I recall correctly, you were court-martialed in disgrace.","But, sir, that plan makes no sense."
"This is awesome! We're gonna be like pow-pow-pow, and they're gonna be like ... ... and then we'll have pancakes to celebrate and I'll be like...",Prepare to continue the epic struggle between good and neutral.,"Nailed you, buddy!"
"Good, good, then what?","Now we crash the ship into their headquarters, killing them in a hellish firestorm from which no living thing can escape.","What now, chief?"
Wait a second. Is this plan gonna kill us?,"Then your mission is complete. I, meanwhile, will have ejected to safety, wearing the only spacesuit on board.","Good, good, then what?"
"Leela, we want you to be captain again.",Of course. What do you think I meant by loyalty? Now help me into the only spacesuit. It looks a bit sweaty in there so you may need to apply baby powder.,Wait a second. Is this plan gonna kill us?
We want Leela to be captain again.,Let me guess. He cancelled naptime? He ran out of beer? So he's about to kill us?,"Leela, we want you to be captain again."
Absolutely.,"OK, OK. We have one chance. Are you willing to do what I say as captain?","Leela save me ... and yourself, I guess ... and my banjo. And Fry."
And warm.,"Oh, man, that crap's heavy.",Then go get the hover-dolly you didn't break and load all the dark matter into the left engine.
It's too low.,"Honey, unless we hit a time warp, I wouldn't worry about it.",Hurry! I don't wanna die at the age of 25.
And no one will have to punish anyone for the mutiny.,You did it! You actually did it!,Quick.
"Leela, I just want you to know that even though you're mean, you're the best captain ever.",I-I'll call and tell you about it.,"Come, Kif, we've got work to do."
Please?,No.,"Yeah, you're one dynamite lady. Can we have a week off?"
"Aw, man.",No time off.,"Oh, alright."
What do we care? We live in the United States.,"Look, I know there are no car chases but this is important. One of these two men will become president of the world.",C-SPAN9 presents: The Thrill Of Politics.
Wow! I have been gone a long time.,The United States is part of the world.,What do we care? We live in the United States.
